292111000119104,451431000124104,Disorder of left deep peroneal nerve (disorder),Disorder of left lower extremity (disorder)
247036000,300577008,Focal lesion in iris (finding),Finding of lesion (finding)
208173000,263219008,"Open fracture pelvis, multiple pubic rami - stable (disorder)",Fracture of multiple pubic rami (disorder)
1076581000119101,15729601000119103,Tendonitis of right shoulder (disorder),Arthropathy of right shoulder (disorder)
209657004,239954007,Open division shoulder ligament (disorder),Soft tissue lesion of shoulder region (disorder)
720983002,199879009,Amaurosis hypertrichosis syndrome (disorder),Congenital anomaly of skin (disorder)
720983002,49381001,Amaurosis hypertrichosis syndrome (disorder),Congenital anomaly of retina (disorder)
73962000,280128006,Abscess of peritoneum (disorder),Disorder of soft tissue of body cavity (disorder)
73962000,405549001,Abscess of peritoneum (disorder),Abscess of connective tissue (disorder)
87073000,39797006,Periostitis of upper arm (disorder),Osteitis of upper arm (disorder)
93799003,449628003,Primary malignant neoplasm of fibula (disorder),Malignant neoplasm of long bone of lower leg (disorder)
90790003,53467004,Avoidant disorder of adolescence (disorder),Anxiety disorder of childhood (disorder)
90790003,64165008,Avoidant disorder of adolescence (disorder),Avoidant disorder of childhood (disorder)
90790003,37868008,Avoidant disorder of adolescence (disorder),Anxiety disorder of adolescence (disorder)
209740008,725014003,"Open division, cricothyroid ligament (disorder)",Injury of fascia of neck (disorder)
405561009,280132000,Injury to ligament of cervical spine (disorder),Disorder of soft tissue of neck (disorder)
366635004,298325004,Finding of subtalar joint - range of movement (finding),Finding of movement (finding)
366635004,366626006,Finding of subtalar joint - range of movement (finding),Finding of foot joint - range of movement (finding)
366635004,299470000,Finding of subtalar joint - range of movement (finding),Finding of movement of foot (finding)
449164003,92021007,Pedunculated leiomyoma of uterus (disorder),Benign neoplasm of body of uterus (disorder)
209708009,428339009,Open division foot ligament (disorder),Disorder of joint of foot (disorder)
427103005,280136002,Congenital contracture of gastrocnemius muscle (disorder),Disorder of soft tissue of lower limb (disorder)
95373005,33211000,Application site anesthesia (disorder),Complication of anesthesia (disorder)
366521005,298325004,Finding of wrist joint - range of movement (finding),Finding of movement (finding)
15726921000119105,451431000124104,Disorder of joint of left knee (disorder),Disorder of left lower extremity (disorder)
15748121000119108,299479004,Mass of joint of left foot (finding),Foot joint finding (finding)
732261005,88425004,Cyprus facial neuromusculoskeletal syndrome (disorder),Congenital anomaly of nervous system (disorder)
732261005,73573004,Cyprus facial neuromusculoskeletal syndrome (disorder),Congenital anomaly of musculoskeletal system (disorder)
724944007,280135003,Injury of flexor muscle of thumb at forearm level (disorder),Disorder of soft tissue of upper limb (disorder)
724944007,724940003,Injury of flexor muscle of thumb at forearm level (disorder),Injury of muscle at forearm level (disorder)
329711000119105,451431000124104,Entrapment neuropathy of peripheral nerve of left lower limb (disorder),Disorder of left lower extremity (disorder)
253664001,111321007,Vascular ring with right aortic arch (disorder),Right aortic arch (disorder)
69163003,715852004,Taenia saginata infection (disorder),Infection of gastrointestinal tract (disorder)
69163003,128070006,Taenia saginata infection (disorder),Infectious disease of abdomen (disorder)
272534006,272589009,Standing in water (finding),Position in water (finding)
10925481000119107,12020001000004102,Closed fracture of single right rib (disorder),Fracture of right rib (disorder)
289215003,6893006,First stage of labor problem (finding),First stage of labor (finding)
205097005,73573004,Congenital talipes equinus (disorder),Congenital anomaly of musculoskeletal system (disorder)
15671121000119107,205063003,Congenital genu recurvatum of right knee (disorder),Congenital genu recurvatum (disorder)
285808008,280130008,Injury of peritoneum (disorder),Disorder of soft tissue of abdominal cavity (disorder)
299081006,298230003,Normal passive range of finger extension (finding),Passive range of joint movement normal (finding)
95041005,95124006,Neoplasm of uncertain behavior of second cuneiform bone of foot (disorder),Neoplasm of uncertain behavior of tarsal bone (disorder)
191831000,153491000119103,"Cocaine dependence, continuous (disorder)","Drug dependence, continuous (disorder)"
247647006,247646002,Maintained direction of thought (finding),Direction of thought (finding)
210410008,282768006,Open wound of front wall of thorax (disorder),Injury of front of chest (disorder)
210244004,274168009,Injury of seminal vesicle with open wound into abdominal cavity (disorder),Open wound of genital organ (disorder)
248729008,22447003,Jugular venous pressure raised on inspiration (finding),Raised jugular venous pressure (finding)
210729001,88977003,Open wound of toe(s) with complication (disorder),Open wound of toe with complication (disorder)
210729001,210714003,Open wound of toe(s) with complication (disorder),Open wound of foot with complication (disorder)
210729001,116225000,Open wound of toe(s) with complication (disorder),Complication of injury (disorder)
72882005,239954007,Burn erythema of shoulder (disorder),Soft tissue lesion of shoulder region (disorder)
204046005,702628006,Anomalies of hypothalamus (disorder),Congenital anomaly of cerebrum (disorder)
15631971000119109,429439000,Complex cyst of left ovary (disorder),Complex cyst of uterine adnexa (disorder)
366151006,366152004,Finding of forced vital capacity (finding),Finding of vital capacity (finding)
94252000,126633007,Secondary malignant neoplasm of cheek (disorder),Neoplasm of cheek (disorder)
470749006,280133005,Acquired abnormality of inferior vena cava (disorder),Disorder of soft tissue of trunk (disorder)
722389002,23880008,Congenital hereditary facial paralysis with variable hearing loss syndrome (disorder),Congenital anomaly of peripheral nerve (disorder)
298525003,298230003,Normal passive range of thoracic spine extension (finding),Passive range of joint movement normal (finding)
366265001,271676006,Finding of bladder appearance (finding),Finding of appearance of abdomen (finding)
92125000,92020008,Benign neoplasm of greater curvature of stomach (disorder),Benign neoplasm of body of stomach (disorder)
283427007,239990000,Cut of perineum (disorder),Soft tissue lesion of pelvic region (disorder)
283427007,210484005,Cut of perineum (disorder),Open wound of perineum (disorder)
234144009,280133005,Truncal arteriovenous fistula (disorder),Disorder of soft tissue of trunk (disorder)
262788003,280133005,Injury of thoracic duct (disorder),Disorder of soft tissue of trunk (disorder)
449459006,253488006,Atrioventricular septal defect with atrioventricular valve regurgitation through left inferior bridging leaflet lateral mural commissure (disorder),Left atrioventricular valve regurgitation (disorder)
449116007,20721001,Tricuspid but functionally bicuspid aortic valve (disorder),Tricuspid valve disorder (disorder)
15746881000119100,417555004,Decreased intraocular pressure of left eye (finding),Intraocular pressure left eye (finding)
298652002,298230003,Normal passive range of lumbar spine right rotation (finding),Passive range of joint movement normal (finding)
253193002,88425004,Vascular malformation of the nervous system (disorder),Congenital anomaly of nervous system (disorder)
253415001,253417009,Atrioventricular septal defect - isolated ventricular component (disorder),Atrioventricular septal defect - ventricular component (disorder)
237919007,19416009,Minimal pigment oculocutaneous albinism (disorder),Congenital anomaly of eye (disorder)
450221000124106,11718111000119106,Mass of muscle of left lower limb (finding),Mass of soft tissue of left lower limb (finding)
124151009,124226002,Deficiency of dehydrogluconate dehydrogenase (disorder),Deficiency of dehydrogenase (disorder)
209377002,263093003,Closed fracture subluxation of multiple metatarsophalangeal joints (disorder),Fracture dislocation of toe joint (disorder)
208054001,269078005,Closed fracture of lumbar spine with spinal cord lesion (disorder),Fracture of spine with spinal cord lesion (disorder)
10675001,72970002,Normal pulse rate (finding),Normal vital signs (finding)
716638009,67341007,Longitudinal deficiency of part of limb (disorder),Longitudinal deficiency of limb (disorder)
191839003,191851001,Cannabis dependence in remission (disorder),Hallucinogen dependence in remission (disorder)
191839003,1461000119109,Cannabis dependence in remission (disorder),Drug dependence in remission (disorder)
439469002,247353003,Recurrent abdominal pain (finding),Site of abdominal pain (finding)
428031002,280135003,False aneurysm of distal brachial artery (disorder),Disorder of soft tissue of upper limb (disorder)
428031002,712582008,False aneurysm of distal brachial artery (disorder),Pseudoaneurysm of artery of upper extremity (disorder)
126991009,126994001,Neoplasm of peripheral nerves of thorax (disorder),Neoplasm of peripheral nerves of trunk (disorder)
126991009,280133005,Neoplasm of peripheral nerves of thorax (disorder),Disorder of soft tissue of trunk (disorder)
726199004,280135003,Injury of intrinsic muscle of finger (disorder),Disorder of soft tissue of upper limb (disorder)
298227005,298180004,Passive range of joint movement absent (finding),Finding of range of joint movement (finding)
124285000,124394008,Deficiency of alanine aminotransferase (disorder),Deficiency of aminotransferase (disorder)
94940000,95092002,Neoplasm of uncertain behavior of muscle of buttock (disorder),Neoplasm of uncertain behavior of soft tissues of buttock (disorder)
289893003,289891001,Finding of duration of menstrual period (finding),Finding of duration of menstrual cycle (finding)
239873007,363056008,Osteoarthritis of knee (disorder),Degenerative disorder of extremity (disorder)
93802007,372001002,Primary malignant neoplasm of floor of mouth (disorder),Primary malignant neoplasm of oral cavity (disorder)
109576008,109570002,"Primary dental caries, root surface origin (disorder)",Primary dental caries (disorder)
298210002,299044007,Hand joint laxity (finding),Finding of function of hand (finding)
298210002,299041004,Hand joint laxity (finding),Finding of movement of hand (finding)
45623002,11131000119108,Glaucoma associated with anterior segment anomaly (disorder),Anomaly of eye (disorder)
187956003,372108006,Malignant neoplasm of sacral vertebra (disorder),Malignant neoplasm of bone of lower limb (disorder)
187956003,363438000,Malignant neoplasm of sacral vertebra (disorder),Malignant tumor of vertebral column (disorder)
88244008,280133005,Congenital stenosis of vena cava (disorder),Disorder of soft tissue of trunk (disorder)
268118007,451431000124104,Foreign body left in hip (disorder),Disorder of left lower extremity (disorder)
11830281000119103,451431000124104,Strain of muscle of left thigh (disorder),Disorder of left lower extremity (disorder)
303536005,298229008,Normal active range of cervical spine retraction (finding),Active range of joint movement normal (finding)
196950000,280130008,Retroperitoneal hernia - irreducible (disorder),Disorder of soft tissue of abdominal cavity (disorder)
94512001,94582005,Secondary malignant neoplasm of rectovesical septum (disorder),Secondary malignant neoplasm of soft tissues of abdomen (disorder)
405721006,95695004,Peripheral degeneration of retina (disorder),Degeneration of retina (disorder)
129789007,129790003,Focal asymmetric breast tissue finding (finding),Asymmetric breast tissue finding (finding)
290090005,366346006,Nipples equal in size (finding),Finding of size of breast (finding)
290090005,366351000,Nipples equal in size (finding),Finding of size of nipple (finding)
15712681000119106,280135003,Ischemia of left upper extremity (disorder),Disorder of soft tissue of upper limb (disorder)
93057008,45237002,Congenital dilatation of innominate artery (disorder),Congenital dilatation of aorta (disorder)
93057008,280133005,Congenital dilatation of innominate artery (disorder),Disorder of soft tissue of trunk (disorder)
232401004,128398001,Glandular fever pharyngitis (disorder),Infectious disease of digestive tract (disorder)
209316002,704236005,Open fracture dislocation of interphalangeal joint of thumb (disorder),Open fracture of phalanx of thumb (disorder)
289818008,289670006,Pain on movement of cervix (finding),Pain on movement of uterus (finding)
289818008,289664000,Pain on movement of cervix (finding),Finding of movement of uterus (finding)
289818008,249546002,Pain on movement of cervix (finding),Finding of movement of abdomen (finding)
721196005,271807003,Pemphigus of vulva (disorder),Eruption of skin (disorder)
420180008,102952009,Victim of abusive sexual relationship with wife (finding),Abusive sexual relationship with wife (finding)
230806005,128614008,Brain ventricular shunt infection (disorder),Infectious disease of brain (disorder)
127283002,125593007,Fracture of ethmoid bone (disorder),Injury of face (disorder)
717963001,199879009,Isolated anterior cervical hypertrichosis (disorder),Congenital anomaly of skin (disorder)
717963001,280132000,Isolated anterior cervical hypertrichosis (disorder),Disorder of soft tissue of neck (disorder)
717963001,399893000,Isolated anterior cervical hypertrichosis (disorder),Disorder of skin of neck (disorder)
1089661000119108,1089341000119100,Suppurative otitis media of left ear (disorder),Otitis media of left ear (disorder)
298202003,299574006,Interphalangeal joint of toe hypermobility (finding),Finding of movement of toe (finding)
264906008,237719001,Pituitary macroadenoma with extrasellar extension (disorder),Pituitary adenoma with extrasellar extension (disorder)
302882002,253133004,Hydrocephalus associated with congenital aqueduct stenosis (disorder),Hydrocephalus with anomaly of aqueduct of Sylvius (disorder)
10930521000119102,10930681000119104,Closed fracture of metaphysis of third metatarsal bone of right foot (disorder),Closed fracture of metaphysis of metatarsal bone of right foot (disorder)
94568005,94592002,Secondary malignant neoplasm of skin of perineum (disorder),Secondary malignant neoplasm of soft tissues of perineum (disorder)
191889006,1461000119109,Tobacco dependence in remission (disorder),Drug dependence in remission (disorder)
1691000119104,315000005,Metastasis to liver from adenocarcinoma (disorder),Metastasis from malignant tumor of liver (disorder)
204300001,280133005,Incomplete great vessel transposition (disorder),Disorder of soft tissue of trunk (disorder)
75580000,125661005,Open dislocation of distal end of tibia (disorder),Open wound of lower leg (disorder)
75580000,385424001,Open dislocation of distal end of tibia (disorder),Injury of connective tissue (disorder)
299038008,298748006,Finding of proportion of hand (finding),Finding of proportion of upper limb (finding)
110155005,429433004,Abrasion of maxillary attached gingiva (disorder),Injury of soft tissue of face (disorder)
16004151000119102,15668921000119109,Congenital trigger thumb of left hand (disorder),Congenital deformity of left hand (disorder)
11312521000119105,11312441000119100,Pathological fracture of phalanx of finger of left hand (disorder),Pathological fracture of left hand (disorder)
198749004,74978008,Incomplete illegal abortion with shock (disorder),Illegal abortion with complication (disorder)
710212007,280132000,Neoplasm of cervical spinal nerve (disorder),Disorder of soft tissue of neck (disorder)
13730001000004107,280135003,Thrombosis of vein of upper limb (disorder),Disorder of soft tissue of upper limb (disorder)
298914001,298229008,Normal active range of elbow pronation (finding),Active range of joint movement normal (finding)
10934041000119109,10936361000119104,Closed fracture of coracoid process of right scapula (disorder),Closed fracture of body of right scapula (disorder)
235065009,60528006,Syphilitic oral snail track ulcer (disorder),Secondary syphilis of mouth (disorder)
71491003,116225000,Open wound of scalp with complication (disorder),Complication of injury (disorder)
722002002,78626001,"Intellectual disability, balding, patella luxation, acromicria syndrome (disorder)",Congenital anomaly of trunk (disorder)
109944005,280133005,Benign neoplasm of peripheral nerves of pelvis region (disorder),Disorder of soft tissue of trunk (disorder)
109944005,109946007,Benign neoplasm of peripheral nerves of pelvis region (disorder),Benign neoplasm of peripheral nerves of trunk (disorder)
53913001,70582006,Endometriosis in scar of skin (disorder),Scar of skin (disorder)
724979009,724973005,Laceration of tendon of extensor muscle of finger at forearm level (disorder),Injury of tendon of extensor muscle of finger at forearm level (disorder)
371976008,94053004,Primary malignant neoplasm of buccal mucosa (disorder),Primary malignant neoplasm of soft tissues of face (disorder)
211558005,125647000,"Open crush injury, axilla (disorder)",Open wound of axillary region (disorder)
402841001,126637008,Angiokeratoma of vulva (disorder),Neoplasm of trunk (disorder)
402841001,400106006,Angiokeratoma of vulva (disorder),Disorder of skin of trunk (disorder)
402841001,280133005,Angiokeratoma of vulva (disorder),Disorder of soft tissue of trunk (disorder)
298838001,298230003,Normal passive range of shoulder external rotation (finding),Passive range of joint movement normal (finding)
373434004,280133005,Disorder of blood vessels of thorax (disorder),Disorder of soft tissue of trunk (disorder)
446022000,371972005,Malignant epithelial neoplasm of uterus (disorder),Malignant neoplasm of body of uterus (disorder)
698846009,363056008,Tibial muscular dystrophy (disorder),Degenerative disorder of extremity (disorder)
698846009,84773003,Tibial muscular dystrophy (disorder),Congenital anomaly of lower limb (disorder)
698846009,280136002,Tibial muscular dystrophy (disorder),Disorder of soft tissue of lower limb (disorder)
249513008,249512003,Lacking desire for stool (finding),Desire for stool (finding)
305561005,305582004,Under care of diabetic liaison nurse (finding),Under care of liaison nurse (finding)
281493006,5321004,Acquired fixed flexion deformity of knee (disorder),Acquired deformity of knee (disorder)
13114007,128398001,Blister of lip with infection (disorder),Infectious disease of digestive tract (disorder)
10815901000119106,705087009,Open fracture of proximal phalanx of lesser toe of right foot (disorder),Open fracture of phalanx of lesser toe (disorder)
15747321000119109,16059231000119107,Scintillating scotoma of left eye (finding),Visual field defect of left eye (finding)
93248006,253929007,Congenital hypoplasia of carpal bone (disorder),Hypoplasia of upper limb (disorder)
12235781000119107,16010991000119100,Congenital hammer toe of left foot (disorder),Arthropathy of left foot (disorder)
230417001,71831005,Symptomatic West syndrome (disorder),Symptomatic generalized epilepsy (disorder)
281555003,125604000,Traumatic division of extensor tendon of toe (disorder),Injury of foot (disorder)
389271000,57148006,Spondyloenchondromatosis with basal ganglia calcification (disorder),Congenital anomaly of brain (disorder)
72061003,116225000,Open wound of pharynx with complication (disorder),Complication of injury (disorder)
65276005,116225000,Open wound of trunk with complication (disorder),Complication of injury (disorder)
6802007,239990000,Illegal abortion with perforation of broad ligament (disorder),Soft tissue lesion of pelvic region (disorder)
24210004,49381001,Congenital chorioretinal degeneration (disorder),Congenital anomaly of retina (disorder)
24210004,95490000,Congenital chorioretinal degeneration (disorder),Congenital anomaly of choroid (disorder)
307712005,275329003,Open Barton's fracture (disorder),Dislocation of radius - distal (disorder)
271109002,402694007,Traumatic blister of scalp (disorder),Dermatosis of scalp (disorder)
724282009,237657009,"Hypoparathyroidism, deafness, renal disease syndrome (disorder)",Hypoparathyroidism - autosomal dominant (disorder)
303541002,298229008,Normal active range of cervical spine protraction (finding),Active range of joint movement normal (finding)
364758005,301112006,Finding of fetal heart rhythm (finding),Finding of heart rhythm (finding)
10835621000119104,721153000,Congenital anomaly of vagina in mother complicating pregnancy (disorder),Congenital anomaly of mother complicating pregnancy (disorder)
722674001,254462001,Primary squamous cell carcinoma of parotid gland (disorder),Carcinoma of parotid gland (disorder)
385516009,288509005,Contact burn of skin (disorder),Burn of skin of body region (disorder)
100941000119100,87536007,Epilepsy in mother complicating pregnancy (disorder),Central nervous system complication (disorder)
707388009,733358002,Primary squamous cell carcinoma of trachea (disorder),Primary squamous cell carcinoma of respiratory system (disorder)
267535004,234466008,Congenital thrombocytopenic purpura (disorder),Acquired coagulation disorder (disorder)
22386003,230226000,Syphilitic optic atrophy (disorder),System disorder of the nervous system (disorder)
22386003,721254003,Syphilitic optic atrophy (disorder),Infection of cranial nerve (disorder)
22386003,402947001,Syphilitic optic atrophy (disorder),Late secondary syphilis (disorder)
51474003,61861001,Disturbance in speed of associations (finding),Speed of associations (finding)
365879006,250439007,Urine microscopy: pus cells present (finding),Pus cells present (finding)
703619001,118940003,Pelvic girdle pain (disorder),Disorder of nervous system (disorder)
703619001,609620004,Pelvic girdle pain (disorder),Disorder of pelvis (disorder)
386821008,24125008,Adjustment reaction in infancy (disorder),Mental disorder in infancy (disorder)
123241000119109,92020008,Benign carcinoid tumor of stomach (disorder),Benign neoplasm of body of stomach (disorder)
700259007,95754008,Cicatricial entropion of lower eyelid (disorder),Lower eyelid entropion (disorder)
92715000,126608009,Carcinoma in situ of skin of buttock (disorder),Neoplasm of soft tissues of trunk (disorder)
92715000,92735004,Carcinoma in situ of skin of buttock (disorder),Carcinoma in situ of skin of lower limb (disorder)
366458007,298351002,Finding of form of sternum (finding),Finding of form of bone (finding)
448075009,253285007,Uniatrial biventricular connection with absent right sided atrioventricular connection with straddling valve (disorder),Absent right sided atrioventricular connection (disorder)
247253001,300191005,Ventilation tube in tympanic membrane (finding),Finding of device of middle ear (finding)
240752008,128047003,Rhinosporidial mucosal polyp (disorder),Infectious disease of mucous membrane (disorder)
58154005,28081005,Open fracture of four ribs (disorder),Open fracture of multiple ribs (disorder)
299476006,299226007,Finding of measures of foot (finding),Finding of measures of lower limb (finding)
92813000,92811003,Chronic lymphoid leukemia in remission (disorder),Chronic leukemia in remission (disorder)
92813000,93169003,Chronic lymphoid leukemia in remission (disorder),Lymphoid leukemia in remission (disorder)
248954000,248953006,Discharge from Bartholin's gland (finding),Discharge from vulva (finding)
248954000,248952001,Discharge from Bartholin's gland (finding),Discharge from female genitalia (finding)
1090731000119101,1091951000119104,Acute otitis media of right ear with effusion (disorder),Otitis media of right ear (disorder)
210688001,32976001,Open wound of lower leg with complication (disorder),Open wound of leg with complication (disorder)
210688001,116225000,Open wound of lower leg with complication (disorder),Complication of injury (disorder)
109848009,93715005,Overlapping malignant neoplasm of pancreas (disorder),Primary malignant neoplasm of body of pancreas (disorder)
94944009,95090005,Neoplasm of uncertain behavior of muscle of inguinal region (disorder),Neoplasm of uncertain behavior of soft tissues of abdomen (disorder)
94944009,95097008,Neoplasm of uncertain behavior of muscle of inguinal region (disorder),Neoplasm of uncertain behavior of soft tissues of lower limb (disorder)
322221000119102,451431000124104,Synovial cyst of left popliteal space (disorder),Disorder of left lower extremity (disorder)
1080161000119106,286895009,Infiltrating ductal carcinoma of upper outer quadrant of left female breast (disorder),"Carcinoma of breast - upper, outer quadrant (disorder)"
247395007,280133005,Genitofemoral nerve neuralgia (disorder),Disorder of soft tissue of trunk (disorder)
396564006,397464004,Tumor pigmentation cannot be determined (finding),Tumor configuration cannot be determined (finding)
201474006,443798008,Sexually acquired reactive arthropathy of the shoulder region (disorder),Inflammation of joint of shoulder region (disorder)
1076591000119103,15729561000119103,Tendonitis of left shoulder (disorder),Arthropathy of left shoulder (disorder)
702712006,189243008,Carcinoma in situ of common hepatic duct (disorder),Carcinoma in situ of hepatic duct (disorder)
370057001,370055009,"Tumor invasion into bronchus, invasive (finding)",Tumor invasion into bronchus (finding)
26421009,239990000,Bleeding external hemorrhoids (disorder),Soft tissue lesion of pelvic region (disorder)
718927003,720016003,Somatic dysfunction of sacrococcygeal region (finding),Somatic dysfunction of pelvic region (finding)
