209407000,446196005,"Open fracture subluxation sternoclavicular joint, posterior (disorder)",Subluxation of sternum (disorder)
209407000,281519006,"Open fracture subluxation sternoclavicular joint, posterior (disorder)",Fracture subluxation of joint of upper limb (disorder)
209407000,209225005,"Open fracture subluxation sternoclavicular joint, posterior (disorder)","Open traumatic subluxation, sternoclavicular joint, posterior (disorder)"
369001,72970002,Normal jugular venous pressure (finding),Normal vital signs (finding)
94732002,94852008,Neoplasm of uncertain behavior of alveolar ridge mucosa (disorder),Neoplasm of uncertain behavior of gingival mucosa (disorder)
92056006,92021007,Benign neoplasm of uterine cervix (disorder),Benign neoplasm of body of uterus (disorder)
60952007,42930003,Urocanate hydratase deficiency (disorder),Inborn error of amino acid metabolism (disorder)
721622001,254547001,Primary adenocarcinoma of upper third of esophagus (disorder),Carcinoma of upper third of esophagus (disorder)
92673009,92547008,Carcinoma in situ of pancreatic duct (disorder),Carcinoma in situ of body of pancreas (disorder)
719191003,280135003,Atrophy of deltoid muscle (disorder),Disorder of soft tissue of upper limb (disorder)
719191003,363056008,Atrophy of deltoid muscle (disorder),Degenerative disorder of extremity (disorder)
719191003,363058009,Atrophy of deltoid muscle (disorder),Degenerative disorder of muscle (disorder)
289780002,289644005,Finding of arrangement of uterine cervix (finding),Finding of arrangement of uterus (finding)
431329002,29542008,Spasm of cervix uteri (finding),Spasm of uterus (finding)
45833007,385424001,Open dislocation of navicular bone of foot (disorder),Injury of connective tissue (disorder)
208397004,208401007,Closed fracture finger metacarpal base (disorder),Closed fracture finger metacarpal (disorder)
305503006,305494005,Under care of pediatric neurologist (finding),Under care of neurologist (finding)
292001000119101,291981000119101,Entrapment neuropathy of left genitofemoral nerve (disorder),Neuropathy of left genitofemoral nerve (disorder)
292001000119101,451431000124104,Entrapment neuropathy of left genitofemoral nerve (disorder),Disorder of left lower extremity (disorder)
292001000119101,329711000119105,Entrapment neuropathy of left genitofemoral nerve (disorder),Entrapment neuropathy of peripheral nerve of left lower limb (disorder)
28810003,51474003,Flight of ideas (finding),Disturbance in speed of associations (finding)
28810003,61861001,Flight of ideas (finding),Speed of associations (finding)
211566001,125649002,"Open crush injury, forearm (disorder)",Open wound of forearm (disorder)
724929006,724923007,Laceration of tendon of biceps brachii (disorder),Injury of tendon of biceps brachii (disorder)
299093002,298183002,Increased passive range of finger abduction (finding),Passive range of joint movement increased (finding)
416833005,36991002,Closed fracture dislocation of joint of shoulder girdle (disorder),Closed fracture of upper limb (disorder)
719521002,280132000,Benign paroxysmal torticollis of infancy (disorder),Disorder of soft tissue of neck (disorder)
423261004,125584006,Acquired pelvic obliquity (disorder),Acquired deformity of lower limb (disorder)
423261004,88577008,Acquired pelvic obliquity (disorder),Deformity of pelvis (disorder)
186259007,447399004,Scrofulous tuberculous abscess (disorder),Tuberculous abscess of neck (disorder)
277831002,48079002,Anxiety about becoming fat (finding),Disturbance in mood (finding)
188541000,93197009,Hodgkin's granuloma of lymph nodes of multiple sites (disorder),Malignant lymphoma of lymph nodes of multiple sites (disorder)
188541000,93526001,Hodgkin's granuloma of lymph nodes of multiple sites (disorder),Hodgkin's disease of lymph nodes of multiple sites (disorder)
93885006,93953009,Primary malignant neoplasm of male genital organ (disorder),Primary malignant neoplasm of pelvis (disorder)
10737281000119109,12238631000119108,Mature cystic teratoma of right ovary (disorder),Cyst of right ovary (disorder)
10737281000119109,716077006,Mature cystic teratoma of right ovary (disorder),Teratoma of ovary (disorder)
299943004,302261000,Normal joint position sense (finding),Nervous system normal (finding)
15631931000119106,429439000,Complex cyst of right ovary (disorder),Complex cyst of uterine adnexa (disorder)
228160005,105720005,Hand function disability (finding),Finding related to general body function (finding)
372024009,371971003,Primary malignant neoplasm of uterine cervix (disorder),Primary malignant neoplasm of body of uterus (disorder)
10823171000119108,705087009,Open fracture of distal phalanx of lesser toe of left foot (disorder),Open fracture of phalanx of lesser toe (disorder)
203201006,203241002,Brodie's abscess of sacrum (disorder),Osteomyelitis of vertebra (disorder)
203201006,430886005,Brodie's abscess of sacrum (disorder),Disorder of vertebra (disorder)
203201006,75564005,Brodie's abscess of sacrum (disorder),Osteitis of pelvic region (disorder)
203201006,203299001,Brodie's abscess of sacrum (disorder),Subacute osteomyelitis of sacrum (disorder)
449718004,211849005,Full thickness burn of multiple sites of upper arm (disorder),Full thickness burn of arm (disorder)
1542009,128347007,Omphalocele with obstruction (disorder),Congenital anomaly of gastrointestinal tract (disorder)
1542009,128332003,Omphalocele with obstruction (disorder),Congenital anomaly of digestive organ (disorder)
1542009,363026004,Omphalocele with obstruction (disorder),Congenital anomaly of body cavity (disorder)
298810009,298229008,Normal active range of shoulder adduction (finding),Active range of joint movement normal (finding)
389216001,428281000,Diaphyseal medullary stenosis with bone malignancy (disorder),Malignant neoplasm of bone (disorder)
292711000119100,230631009,Ulnar nerve entrapment at left elbow (disorder),Ulnar nerve entrapment at elbow (disorder)
292711000119100,239964003,Ulnar nerve entrapment at left elbow (disorder),Soft tissue lesion of elbow region (disorder)
200295006,200294005,Amniotic fluid pulmonary embolism - delivered with postnatal complication (disorder),Amniotic fluid pulmonary embolism - delivered (disorder)
200295006,200297003,Amniotic fluid pulmonary embolism - delivered with postnatal complication (disorder),Amniotic fluid pulmonary embolism with postnatal complication (disorder)
366438006,366427006,Finding of range of lumbar spine left lateral flexion (finding),Finding of range of flexion of lumbar spine (finding)
283980002,446390008,Crushing injury of pancreas (disorder),Traumatic injury of body of pancreas (disorder)
240594008,189176002,Genital mycoplasma infection (disorder),Infectious disease of genitourinary system (disorder)
298537001,298183002,Increased passive range of thoracic spine right lateral flexion (finding),Passive range of joint movement increased (finding)
193308004,78348000,Old intraocular nonmagnetic foreign body in lens of eye (disorder),Retained nonmagnetic foreign body in lens (disorder)
289266008,289633002,Finding of form of placenta (finding),Finding of form of uterus (finding)
203049007,280135003,Dupuytren's disease of finger (disorder),Disorder of soft tissue of upper limb (disorder)
203049007,94591000119100,Dupuytren's disease of finger (disorder),Neoplasm of soft tissue of hand (disorder)
193225000,363058009,Hereditary progressive muscular dystrophy (disorder),Degenerative disorder of muscle (disorder)
444462006,263017003,Developmental dislocation of joint of shoulder region (disorder),Dislocation of joint of upper limb (disorder)
366648000,299468009,Finding of toe joint color (finding),Finding of color of foot (finding)
366648000,365163008,Finding of toe joint color (finding),Finding of color of limb (finding)
366648000,366634000,Finding of toe joint color (finding),Finding of foot joint color (finding)
253519009,93247001,Hypoplasia of right ventricular inflow tract (disorder),Congenital hypoplasia of cardiac ventricle (disorder)
238827004,363027008,Localized abdominal wall skin atrophy (disorder),Congenital anomaly of body wall (disorder)
238827004,78626001,Localized abdominal wall skin atrophy (disorder),Congenital anomaly of trunk (disorder)
230256009,363058009,Benign monomelic amyotrophy (disorder),Degenerative disorder of muscle (disorder)
301241000119107,285391000,Repetitive strain injury of right ankle (disorder),Strain of muscle of lower limb (disorder)
301241000119107,280136002,Repetitive strain injury of right ankle (disorder),Disorder of soft tissue of lower limb (disorder)
235936000,312158001,Infection of biliary stent (disorder),Infection of digestive system (disorder)
235936000,128070006,Infection of biliary stent (disorder),Infectious disease of abdomen (disorder)
443002008,363056008,Chondrocalcinosis of hip joint (disorder),Degenerative disorder of extremity (disorder)
443002008,363055007,Chondrocalcinosis of hip joint (disorder),Degenerative disorder of cartilage (disorder)
443002008,445496008,Chondrocalcinosis of hip joint (disorder),Chondrocalcinosis of joint of pelvis (disorder)
191502008,128614008,"Acute confusional state, of infective origin (disorder)",Infectious disease of brain (disorder)
209576007,239954007,Rupture of acromioclavicular ligament (disorder),Soft tissue lesion of shoulder region (disorder)
447405001,14893008,Friction burn of hand (disorder),Burn of hand (disorder)
365123007,365122002,Finding related to ability to use stair lift (finding),Finding related to ability to use lift (finding)
209396003,18336000,"Open fracture dislocation sternoclavicular joint, anterior (disorder)",Open fracture of upper limb (disorder)
209396003,263073006,"Open fracture dislocation sternoclavicular joint, anterior (disorder)",Fracture dislocation of joint of upper limb (disorder)
209396003,17290007,"Open fracture dislocation sternoclavicular joint, anterior (disorder)",Open dislocation of sternum (disorder)
715487005,363056008,Autosomal recessive distal osteolysis syndrome (disorder),Degenerative disorder of extremity (disorder)
715487005,363054006,Autosomal recessive distal osteolysis syndrome (disorder),Degenerative disorder of bone (disorder)
715487005,73573004,Autosomal recessive distal osteolysis syndrome (disorder),Congenital anomaly of musculoskeletal system (disorder)
299650003,419003001,Amputated at lower thigh (finding),Finding of thigh (finding)
299650003,299651004,Amputated at lower thigh (finding),Amputated at knee (finding)
422599000,403899005,Squamous cell carcinoma of back (disorder),Squamous cell carcinoma of skin of trunk (disorder)
15671007,51655004,Encephalocele of orbit (disorder),Congenital anomaly of skull (disorder)
363349007,126827000,Malignant tumor of stomach (disorder),Neoplasm of body of stomach (disorder)
73280003,116225000,Illegal abortion with laceration of vagina (disorder),Complication of injury (disorder)
208012004,269078005,Open fracture of cervical spine with spinal cord lesion (disorder),Fracture of spine with spinal cord lesion (disorder)
24807004,280133005,Bleeding gastric varices (disorder),Disorder of soft tissue of trunk (disorder)
246644008,39926002,Sees haloes around objects (finding),Sees haloes around lights (finding)
162552006,289139004,Irregular meal frequency (finding),Finding of frequency of eating (finding)
300854002,300577008,Mass of oral cavity (finding),Finding of lesion (finding)
232022001,232021008,Proliferative diabetic retinopathy with new vessels elsewhere than on disc (disorder),Proliferative diabetic retinopathy with new vessels on disc (disorder)
721862000,49381001,Joubert syndrome with oculorenal defect (disorder),Congenital anomaly of retina (disorder)
721862000,204957003,Joubert syndrome with oculorenal defect (disorder),Medullary cystic disease (disorder)
721862000,78626001,Joubert syndrome with oculorenal defect (disorder),Congenital anomaly of trunk (disorder)
47040006,280133005,Disorder of aorta (disorder),Disorder of soft tissue of trunk (disorder)
283400008,429433004,Cut of face (disorder),Injury of soft tissue of face (disorder)
169831006,364738009,Triplets - all live born (finding),Finding of outcome of delivery (finding)
82453008,239990000,Thrombosis of iliac artery (disorder),Soft tissue lesion of pelvic region (disorder)
305561000119105,15726881000119103,Contracture of right knee joint (disorder),Disorder of joint of right knee (disorder)
429432009,125594001,Injury of nerve of shoulder region (disorder),Injury of shoulder region (disorder)
429432009,239954007,Injury of nerve of shoulder region (disorder),Soft tissue lesion of shoulder region (disorder)
191554003,191530008,Acute exacerbation of subchronic paranoid schizophrenia (disorder),Acute exacerbation of subchronic schizophrenia (disorder)
126525002,126606008,Neoplasm of skin of hip (disorder),Neoplasm of soft tissues of hip (disorder)
14136000,239990000,Miscarriage with perforation of broad ligament (disorder),Soft tissue lesion of pelvic region (disorder)
198066009,198064007,Tunica vaginalis stricture (disorder),Male genital organ stricture (disorder)
296333009,296290006,Caffeine overdose of undetermined intent (disorder),Central nervous system stimulant overdose (disorder)
724952005,724942006,Laceration of flexor tendon of thumb at forearm level (disorder),Injury of tendon at forearm level (disorder)
724952005,724970008,Laceration of flexor tendon of thumb at forearm level (disorder),Laceration of flexor tendon at forearm level (disorder)
15741921000119104,451431000124104,Acquired deformity of left foot (disorder),Disorder of left lower extremity (disorder)
452581000124109,452531000124108,Transition of care from hospice to emergency department (finding),Transition of care from emergency department to hospice (finding)
39968002,86631001,Absence of vital signs (finding),Absence of signs (finding)
461410003,451431000124104,Acquired abnormality of left femoral vein (disorder),Disorder of left lower extremity (disorder)
67962003,280133005,Thrombosis of testis (disorder),Disorder of soft tissue of trunk (disorder)
64268004,73573004,Median palatal cyst (disorder),Congenital anomaly of musculoskeletal system (disorder)
64268004,95473006,Median palatal cyst (disorder),Congenital anomaly of jaw (disorder)
11055151000119108,287006005,Seropositive rheumatoid arthritis of multiple joints (disorder),Rheumatoid arthritis of multiple joints (disorder)
11055151000119108,36941000119103,Seropositive rheumatoid arthritis of multiple joints (disorder),Arthropathy of multiple joints (disorder)
253661009,268184003,Double aortic arch with unilateral hypoplasia (disorder),Hypoplasia of aorta (disorder)
281491008,125584006,Acquired fixed flexion deformity of joint of lower limb (disorder),Acquired deformity of lower limb (disorder)
719951002,715710001,Triphalangeal thumb with brachyectrodactyly syndrome (disorder),Polydactyly of triphalangeal thumb (disorder)
298614003,298182007,Increased active range of lumbar spine extension (finding),Active range of joint movement increased (finding)
209323001,416709006,Closed fracture subluxation of proximal interphalangeal joint (disorder),"Closed traumatic subluxation, proximal interphalangeal joint of digit of hand (disorder)"
209323001,209307001,Closed fracture subluxation of proximal interphalangeal joint (disorder),Closed fracture dislocation of proximal interphalangeal joint (disorder)
209323001,263105002,Closed fracture subluxation of proximal interphalangeal joint (disorder),Fracture subluxation of joint of hand (disorder)
209323001,36991002,Closed fracture subluxation of proximal interphalangeal joint (disorder),Closed fracture of upper limb (disorder)
209323001,208862005,Closed fracture subluxation of proximal interphalangeal joint (disorder),"Closed traumatic dislocation, proximal interphalangeal joint (disorder)"
722934009,206568009,Neonatal difficulty in feeding at breast (finding),Difficulty in feeding at breast (finding)
204740005,24291004,Long segment Hirschsprung's disease (disorder),Congenital dilatation of colon (disorder)
204740005,360441005,Long segment Hirschsprung's disease (disorder),Aganglionosis of colon (disorder)
204740005,722996009,Long segment Hirschsprung's disease (disorder),Congenital malformation of autonomic nervous system (disorder)
208879004,208861003,"Closed traumatic subluxation, distal interphalangeal joint (disorder)","Closed traumatic dislocation, distal interphalangeal joint (disorder)"
93669004,371992003,Primary malignant neoplasm of anal canal (disorder),Primary malignant neoplasm of intestinal tract (disorder)
209412004,239954007,"Sprain, coracoclavicular ligament (disorder)",Soft tissue lesion of shoulder region (disorder)
298255009,298179002,Pain on joint movement (finding),Finding of joint movement (finding)
262900003,40095003,Disruption of pelviureteric junction (disorder),Injury of kidney (disorder)
707346000,707345001,Primary carcinoma of ethmoidal sinus (disorder),Primary carcinoma of accessory sinus (disorder)
446471000124105,10933761000119108,Closed subcapital fracture of left femur (disorder),Closed fracture of left femur (disorder)
248911005,289623005,Uterine cervix absent (finding),Body of uterus absent (finding)
210666001,45017008,Open wound of thigh with complication (disorder),Open wound of lower limb with complication (disorder)
210666001,116225000,Open wound of thigh with complication (disorder),Complication of injury (disorder)
403345006,267811000,Hair shaft damage from permanent waving (disorder),Disorder of hair shaft (disorder)
13160009,111750002,Complication of transplanted intestines (disorder),Complication affecting body system (disorder)
237606005,205583005,Hereditary benign acanthosis nigricans with insulin resistance (disorder),Hereditary benign acanthosis nigricans (disorder)
247068008,271570007,Aphakia - lens capsule present (disorder),Disorder of lens capsule (disorder)
449115006,301108000,Tricuspid aortic valve present (finding),Tricuspid valve finding (finding)
713834002,225823009,Victim of child sexual exploitation (finding),Victim of exploitation (finding)
56890008,417876002,Victim of sexual aggression (finding),Victim of abusive sexual relationship (finding)
93548007,447885009,Hodgkin's sarcoma of intrapelvic lymph nodes (disorder),Sarcoma of pelvis (disorder)
92684002,92594000,Carcinoma in situ of placenta (disorder),Carcinoma in situ of female genital organ (disorder)
191820008,153501000119105,Episodic opioid dependence (disorder),"Drug dependence, episodic (disorder)"
40500006,116225000,Illegal abortion with laceration of uterus (disorder),Complication of injury (disorder)
271148002,239954007,Traumatic blister of shoulder (disorder),Soft tissue lesion of shoulder region (disorder)
299429002,298230003,Normal passive range of ankle flexion (finding),Passive range of joint movement normal (finding)
287035002,239954007,Rupture of synovium of shoulder (disorder),Soft tissue lesion of shoulder region (disorder)
25904003,234466008,Acquired coagulation factor deficiency (disorder),Acquired coagulation disorder (disorder)
230214005,441806004,Cerebral hydatid cyst (disorder),Abscess of brain (disorder)
230214005,128614008,Cerebral hydatid cyst (disorder),Infectious disease of brain (disorder)
11306961000119109,446581000124107,Closed fracture of left ischium (disorder),Closed fracture of left lower limb (disorder)
704150005,297130008,Open fracture of proximal phalanx of middle finger (disorder),Fracture of proximal phalanx of finger (disorder)
282085000,262854000,Serosal tear of ileum (disorder),Serosal tear of small intestine (disorder)
209259009,209258001,Closed fracture subluxation superior radioulnar joint (disorder),Closed fracture subluxation elbow joint (disorder)
209259009,208790004,Closed fracture subluxation superior radioulnar joint (disorder),Closed traumatic dislocation superior radioulnar joint (disorder)
109573000,109570002,"Primary dental caries, proximal smooth surface origin (disorder)",Primary dental caries (disorder)
109573000,711175004,"Primary dental caries, proximal smooth surface origin (disorder)",Caries of smooth surface of tooth (disorder)
300466004,300437002,Finding of measures of bladder (finding),Finding of measures of abdomen (finding)
3660008,128347007,Lethal glossopharyngeal defect (disorder),Congenital anomaly of gastrointestinal tract (disorder)
3660008,128332003,Lethal glossopharyngeal defect (disorder),Congenital anomaly of digestive organ (disorder)
3660008,128334002,Lethal glossopharyngeal defect (disorder),Congenital anomaly of mouth (disorder)
10937561000119108,11791681000119101,Closed fracture of triquetral bone of right wrist (disorder),Injury of right wrist (disorder)
298418007,298182007,Increased active range of cervical spine extension (finding),Active range of joint movement increased (finding)
109924004,92098009,Benign neoplasm of peripheral nerves of face (disorder),Benign neoplasm of face (disorder)
389273002,128332003,Cherubism with gingival fibromatosis (disorder),Congenital anomaly of digestive organ (disorder)
389273002,95470009,Cherubism with gingival fibromatosis (disorder),Congenital anomaly of digestive tract (disorder)
389273002,95473006,Cherubism with gingival fibromatosis (disorder),Congenital anomaly of jaw (disorder)
203955004,430886005,Spina bifida with stenosis of aqueduct of Sylvius (disorder),Disorder of vertebra (disorder)
124109002,124236005,Deficiency of aldehyde reductase (disorder),Deficiency of reductase (disorder)
400167000,288509005,Caustic burn of skin (disorder),Burn of skin of body region (disorder)
88977003,210714003,Open wound of toe with complication (disorder),Open wound of foot with complication (disorder)
726227002,280136002,Injury of tendon of adductor muscle of thigh (disorder),Disorder of soft tissue of lower limb (disorder)
423858006,288509005,Scald of skin (disorder),Burn of skin of body region (disorder)
275337006,18336000,Shoulder fracture - open (disorder),Open fracture of upper limb (disorder)
15748001000119103,299479004,Mass of joint of right foot (finding),Foot joint finding (finding)
721685001,715852004,Parasitic infection causing colitis (disorder),Infection of gastrointestinal tract (disorder)
721685001,128070006,Parasitic infection causing colitis (disorder),Infectious disease of abdomen (disorder)
289638006,289674002,Uterus normal shape (finding),Body of uterus normal (finding)
300122008,300085005,Finding of appearance of ear canal (finding),Finding of appearance of ear (finding)
129866007,129868008,Deficient knowledge of medication regimen (finding),Deficient knowledge of therapeutic regimen (finding)
129866007,706869001,Deficient knowledge of medication regimen (finding),Deficient knowledge of medication (finding)
403862005,255184001,Plane basal cell papilloma (disorder),Papilloma of skin (disorder)
298618000,298230003,Normal passive range of lumbar spine extension (finding),Passive range of joint movement normal (finding)
11833591000119105,15728881000119102,Sprain of right ankle (disorder),Disorder of joint of right ankle (disorder)
95079000,95101004,Neoplasm of uncertain behavior of skin of shoulder (disorder),Neoplasm of uncertain behavior of soft tissues of shoulder (disorder)
94925002,94993004,Neoplasm of uncertain behavior of male genital organ (disorder),Neoplasm of uncertain behavior of pelvis (disorder)
254207007,199879009,Reticulate vascular nevus (disorder),Congenital anomaly of skin (disorder)
204042007,702628006,Congenital malformation of corpus callosum (disorder),Congenital anomaly of cerebrum (disorder)
314213003,445408000,Brodie's abscess of tibia (disorder),Osteomyelitis of tibia (disorder)
48549003,63692006,Fibrosis of tunica vaginalis (disorder),Fibrosis of scrotum (disorder)
313521000119101,300321000119104,Mallet finger of right hand (disorder),Acquired deformity of right hand (disorder)
211997007,360068000,"Deep full thickness burn of the toe(s), with loss of body part (disorder)",Deep full thickness burn (disorder)
24187003,301867009,Collar of Stokes (disorder),Edema of trunk (disorder)
301051000119101,448589005,Juvenile idiopathic arthritis of right hand (disorder),Inflammation of joint of hand (disorder)
193728002,397542006,"Better eye: moderate visual impairment, Lesser eye: moderate visual impairment (disorder)",Moderate visual impairment (disorder)
399967006,126827000,Neoplasm of uncertain behavior of stomach (disorder),Neoplasm of body of stomach (disorder)
255131000,109850001,"Carcinoma in situ of oral cavity, lips, salivary glands (disorder)",Carcinoma in situ of digestive organ (disorder)
255131000,92643000,"Carcinoma in situ of oral cavity, lips, salivary glands (disorder)",Carcinoma in situ of lip (disorder)
93406002,203514008,Congenital thickening of radius (disorder),Hypertrophy of bone (disorder)
719096006,128352002,Brittle cornea syndrome (disorder),Congenital anomaly of cornea (disorder)
15686121000119109,12241711000119100,Osteoarthritis of left temporomandibular joint (disorder),Left temporomandibular joint disorder (disorder)
428106000,36941000119103,Arthropathy of multiple joints associated with a neurological disorder (disorder),Arthropathy of multiple joints (disorder)
63942007,280133005,Injury of nerve of trunk (disorder),Disorder of soft tissue of trunk (disorder)
6214005,300438007,Normal small intestine secretion (finding),Gastrointestinal tract normal (finding)
92788005,126909004,Carcinoma in situ of uterus (disorder),Neoplasm of body of uterus (disorder)
208924008,275326005,"Acute meniscal tear, lateral, bucket handle tear (disorder)",Bucket handle tear of lateral meniscus of knee (disorder)
198620003,17433009,Ruptured tubal pregnancy (disorder),Ruptured ectopic pregnancy (disorder)
