408715008,397413000,Degree of blood vessel lumen diameter reduction (observable entity),Vessel lumen diameter (observable entity)
299527002,364516009,Subtalar joint - range of movement (observable entity),Movement of foot (observable entity)
299527002,299485006,Subtalar joint - range of movement (observable entity),Foot joint - range of movement (observable entity)
725884005,725885006,Movement Assessment Battery for Children Checklist Second Edition total score (observable entity),Movement Assessment Battery for Children Second Edition total score (observable entity)
364005009,363993000,Appearance of tympanic membrane (observable entity),Appearance of ear (observable entity)
425875003,426524000,End tidal enflurane concentration (observable entity),Expired enflurane concentration (observable entity)
718762000,720482000,Child Session Rating Scale score (observable entity),Session Rating Scale score (observable entity)
364430001,364432009,Measure of lumbar spine (observable entity),Measure of spine (observable entity)
251936000,271306003,Best ever peak expiratory flow rate (observable entity),Best ever peak flow rate (respiratory) (observable entity)
298622005,298600003,Range of lumbar spine right lateral flexion (observable entity),Range of flexion of lumbar spine (observable entity)
250787001,250782007,Inspired carbon dioxide tension (observable entity),Inspired carbon dioxide concentration (observable entity)
373197004,396361002,"Polyp size, largest dimension (observable entity)","Lesion size, largest dimension (observable entity)"
395509006,396362009,"Polyp size, additional dimension (observable entity)","Lesion size, additional dimension (observable entity)"
364400009,364401008,Feature of fluid loss (observable entity),Feature of fluid balance (observable entity)
364280009,364254008,Form of uterine cervix (observable entity),Form of uterus (observable entity)
281395000,248241002,Glasgow coma score eye opening subscore (observable entity),Glasgow coma score (observable entity)
364486001,364467009,Measure of hand (observable entity),Measure of upper limb (observable entity)
364287007,364282001,Feature of consistency of cervical mucous (observable entity),Consistency of uterine cervix (observable entity)
364287007,364255009,Feature of consistency of cervical mucous (observable entity),Consistency of uterus (observable entity)
16679002,13226008,"Inhibition of pancreatic secretion, function (observable entity)","Pancreatic secretion, function (observable entity)"
286411008,286367001,Ability to speak at normal rate (observable entity),Ability to speak (observable entity)
396515003,385393001,Distance of malignant melanoma from closest lateral margin (observable entity),Distance of malignant neoplasm from closest lateral margin (observable entity)
364311000,364310004,Duration of menstrual period (observable entity),Duration of menstrual cycle (observable entity)
129008009,364142000,"Bowel control, function (observable entity)",Digestive system observable (observable entity)
249521002,162098000,Frequency of bowel action (observable entity),Frequency of defecation (observable entity)
396402005,371487005,"Tumor extent of invasion, macroscopic (observable entity)",Tumor extent of invasion (observable entity)
224476002,224494008,Availability of help from lay carer (observable entity),Availability of informal carer (observable entity)
446964003,447268003,Large Allen cognitive level screening score (observable entity),Allen cognitive level screening score (observable entity)
364380006,364374003,Color of nipple (observable entity),Color of breast (observable entity)
281053000,268476009,Sex of baby at delivery (observable entity),Sex of baby (observable entity)
441868000,442371002,Start time of procedure room cleaning (observable entity),Start time of procedure (observable entity)
304293009,364142000,Drinking hot drink (observable entity),Digestive system observable (observable entity)
