300346007,300577008,Lesion of gallbladder (finding),Finding of lesion (finding)
304652006,415806002,Difficulty using decision making strategies (finding),Using decision making strategies (finding)
124148002,124226002,Deficiency of choline dehydrogenase (disorder),Deficiency of dehydrogenase (disorder)
191838006,153501000119105,"Cannabis dependence, episodic (disorder)","Drug dependence, episodic (disorder)"
191838006,191850000,"Cannabis dependence, episodic (disorder)","Hallucinogen dependence, episodic (disorder)"
15649141000119104,47040006,Aneurysm of left internal iliac artery (disorder),Disorder of aorta (disorder)
15649141000119104,280133005,Aneurysm of left internal iliac artery (disorder),Disorder of soft tissue of trunk (disorder)
15649141000119104,301433005,Aneurysm of left internal iliac artery (disorder),Aneurysm of artery of trunk (disorder)
372005006,188230001,Primary malignant neoplasm of penis (disorder),Malignant tumor of body of penis (disorder)
240266004,473025000,Disorder of prosthetic joint (disorder),Complication associated with musculoskeletal implant (disorder)
436351000124106,399522007,Neoplasm of colon regional lymph node staging category NX: regional lymph nodes cannot be assessed (finding),Regional lymph nodes cannot be assessed (finding)
436351000124106,301855007,Neoplasm of colon regional lymph node staging category NX: regional lymph nodes cannot be assessed (finding),Finding of lymph node (finding)
124181001,124228001,Deficiency of sarcosine oxidase (disorder),Deficiency of oxidase (disorder)
385530004,288509005,Food burn of skin (disorder),Burn of skin of body region (disorder)
281524009,428107009,Injury to triangular fibrocartilage of wrist joint (disorder),Disorder of wrist joint (disorder)
284221001,211768003,Superficial corrosion of genitalia (disorder),Corrosion of first degree of trunk (disorder)
717914000,93317000,"Blepharophimosis, ptosis, esotropia, syndactyly, short stature syndrome (disorder)",Congenital malposition of digit (disorder)
2245007,74699008,Foreign body in nasopharynx (disorder),Foreign body in nose (disorder)
723364003,4041005,Hypotrichosis with juvenile macular degeneration syndrome (disorder),Congenital anomaly of macula (disorder)
349051000119105,341921000119102,Cellulitis of left eyelid (disorder),Blepharitis of left eyelid (disorder)
733097003,400106006,"Ichthyosis, intellectual disability, dwarfism, renal impairment syndrome (disorder)",Disorder of skin of trunk (disorder)
733097003,280133005,"Ichthyosis, intellectual disability, dwarfism, renal impairment syndrome (disorder)",Disorder of soft tissue of trunk (disorder)
733097003,78626001,"Ichthyosis, intellectual disability, dwarfism, renal impairment syndrome (disorder)",Congenital anomaly of trunk (disorder)
425871007,430886005,Congenital spondylolisthesis of cervical vertebra (disorder),Disorder of vertebra (disorder)
232142007,128116006,Infective paralysis of accommodation (disorder),Infectious disease of nervous system (disorder)
192706006,87536007,Post typhoid vaccination encephalitis (disorder),Central nervous system complication (disorder)
262867002,262872006,Serosal tear of cecum (disorder),Serosal tear of colon (disorder)
298396009,430886005,Deformity of cervical vertebra (disorder),Disorder of vertebra (disorder)
53286005,39797006,Medial epicondylitis of elbow joint (disorder),Osteitis of upper arm (disorder)
300108008,282037001,Numbness of pinna (finding),Absence of ear (finding)
193714008,193716005,"Better eye: severe visual impairment, Lesser eye: total visual impairment (disorder)","Better eye: severe visual impairment, Lesser eye: profound visual impairment (disorder)"
193714008,397541004,"Better eye: severe visual impairment, Lesser eye: total visual impairment (disorder)",Severe visual impairment (disorder)
202580003,280135003,Synovial osteochondromatosis of wrist (disorder),Disorder of soft tissue of upper limb (disorder)
8551000175104,397917005,Urethral urinary catheter in situ for long term use (finding),Equipment in use (finding)
94840001,95124006,Neoplasm of uncertain behavior of first cuneiform bone of foot (disorder),Neoplasm of uncertain behavior of tarsal bone (disorder)
238666005,121000119106,Lichen planus of lips (disorder),Lesion of skin of face (disorder)
298898003,298183002,Increased passive range of elbow extension (finding),Passive range of joint movement increased (finding)
94471000,94248000,Secondary malignant neoplasm of parietal lobe (disorder),Secondary malignant neoplasm of cerebrum (disorder)
36794003,193745007,Impairment level: low vision of one eye (disorder),"Low vision, one eye (disorder)"
232418000,128398001,Acute infection of tonsillar remnant (disorder),Infectious disease of digestive tract (disorder)
129816001,129818000,Instrumental activity of daily living alteration (finding),Activity of daily living alteration (finding)
124162009,124226002,Deficiency of oxoglutarate dehydrogenase (lipoamide) (disorder),Deficiency of dehydrogenase (disorder)
53740009,239990000,Polyp of broad ligament (disorder),Soft tissue lesion of pelvic region (disorder)
12241671000119104,318711000119107,Osteoarthritis of finger joint of right hand (disorder),Osteoarthritis of joint of right hand (disorder)
277505007,87121000119102,Medulloblastoma of cerebellum (disorder),Malignant glioma of cerebellum (disorder)
12241911000119102,451431000124104,Plantar wart of left foot (disorder),Disorder of left lower extremity (disorder)
726195005,726192008,Strain of tendon of intrinsic muscle of thumb (disorder),Injury of tendon of intrinsic muscle of thumb (disorder)
373786007,408773008,Reasons for treatment delay (finding),Reasons for treatment (finding)
213104001,473042006,Mechanical complication of internal joint prosthesis (disorder),Mechanical complication of musculoskeletal implant (disorder)
724975003,724972000,Strain of fascia of extensor muscle of finger at forearm level (disorder),Injury of fascia of extensor muscle of finger at forearm level (disorder)
713895003,116225000,Obturator nerve injury during surgery (disorder),Complication of injury (disorder)
416645004,18336000,Open fracture dislocation of joint of shoulder girdle (disorder),Open fracture of upper limb (disorder)
202491008,299526006,Subtalar joint pain (finding),Finding of subtalar joint (finding)
235964005,126861003,Neoplastic cyst of pancreas (disorder),Neoplasm of body of pancreas (disorder)
212248007,285599002,Iliolumbar nerve injury (disorder),Trunk nerve lesion (disorder)
208774004,208754006,Closed traumatic subluxation shoulder joint (disorder),Closed traumatic dislocation of shoulder (disorder)
276320009,300577008,Lesion of mucosa (finding),Finding of lesion (finding)
201964002,443798008,Allergic arthritis of the shoulder region (disorder),Inflammation of joint of shoulder region (disorder)
278637003,278639000,Denture teeth too small (finding),Denture too small (finding)
366723006,384740007,Finding of grade of muscle power (finding),Finding of grade (finding)
68569003,371596008,Manic bipolar I disorder (disorder),Bipolar I disorder (disorder)
203199009,203218005,Brodie's abscess of thoracic spine (disorder),Infection of thoracic spine (disorder)
203199009,203241002,Brodie's abscess of thoracic spine (disorder),Osteomyelitis of vertebra (disorder)
203199009,430886005,Brodie's abscess of thoracic spine (disorder),Disorder of vertebra (disorder)
298915000,298182007,Increased active range of elbow pronation (finding),Active range of joint movement increased (finding)
254180002,414032001,Epidermolysis bullosa simplex with mottled pigmentation (disorder),Disorder of pigmentation (disorder)
292211000119109,451431000124104,Disorder of left lateral plantar nerve (disorder),Disorder of left lower extremity (disorder)
10836701000119109,15728881000119102,Open bimalleolar fracture of right ankle (disorder),Disorder of joint of right ankle (disorder)
94479003,94591009,Secondary malignant neoplasm of pelvic peritoneum (disorder),Secondary malignant neoplasm of soft tissues of pelvis (disorder)
240180001,240179004,Hip juvenile osteochondropathy (disorder),Pelvis juvenile osteochondropathy (disorder)
240180001,75564005,Hip juvenile osteochondropathy (disorder),Osteitis of pelvic region (disorder)
240180001,699207005,Hip juvenile osteochondropathy (disorder),Arthritis of pelvis (disorder)
733360000,286899003,Primary undifferentiated carcinoma of endometrium (disorder),Carcinoma of genital organ (disorder)
208548007,359820003,"Closed fracture of proximal femur, pertrochanteric (disorder)",Closed fracture of neck of femur (disorder)
722686003,255066001,Primary serous carcinoma of uterine adnexa (disorder),Carcinoma of genitourinary organ (disorder)
238904008,724852006,Congenital diffuse lipomatosis (disorder),Lipomatosis of subcutaneous tissue (disorder)
46311005,76658000,Perineal laceration involving fourchette (disorder),Perineal laceration involving labia (disorder)
46311005,274169001,Perineal laceration involving fourchette (disorder),Labia - open wound (disorder)
461293002,280132000,Acquired abnormality of jugular vein (disorder),Disorder of soft tissue of neck (disorder)
32988004,21698002,Open fracture of multiple sites of phalanges of hand (disorder),Open fracture of phalanx of finger (disorder)
721618006,254547001,Primary squamous cell carcinoma of upper third of esophagus (disorder),Carcinoma of upper third of esophagus (disorder)
128064000,280133005,Congenital absence of portal vein (disorder),Disorder of soft tissue of trunk (disorder)
241885000,241869005,Paint thinner causing toxic effect (disorder),Paint causing toxic effect (disorder)
410472006,230226000,Bartonella henselae neuroretinitis (disorder),System disorder of the nervous system (disorder)
15710481000119107,15710401000119104,Atherosclerosis of nonautologous biological bypass graft of right lower limb (disorder),Atherosclerosis of bypass graft of right lower limb (disorder)
249716002,298499003,Rotational deformity of thoracic spine (finding),Lesion of thoracic spine (finding)
249716002,718184009,Rotational deformity of thoracic spine (finding),Rotational deformity of spine (finding)
249716002,298351002,Rotational deformity of thoracic spine (finding),Finding of form of bone (finding)
249716002,249715003,Rotational deformity of thoracic spine (finding),Rotational deformity of trunk (finding)
162040008,247353003,Abdominal migraine - symptom (finding),Site of abdominal pain (finding)
109404008,95463009,Posterior perimaxillary faciosynostosis (disorder),Congenital anomaly of joint (disorder)
366054000,366053006,Finding of fluorescein tear drainage (finding),Finding of tear drainage (finding)
203073004,280136002,Contracture of abductor muscle(s) of hip (disorder),Disorder of soft tissue of lower limb (disorder)
190615004,69316005,Vitamin A deficiency with xerophthalmic corneal scars (disorder),Vitamin A deficiency with xerophthalmia (disorder)
190615004,27796003,Vitamin A deficiency with xerophthalmic corneal scars (disorder),Vitamin A deficiency with conjunctival xerosis (disorder)
702361006,38164009,Crouzon syndrome with acanthosis nigricans (disorder),Congenital anomaly of integument (disorder)
15898009,289232004,Third stage of labor (finding),Finding of third stage of labor (finding)
203417003,430886005,Adult osteochondrosis of spine (disorder),Disorder of vertebra (disorder)
20944008,73573004,Congenital postural scoliosis (disorder),Congenital anomaly of musculoskeletal system (disorder)
79004009,88768004,Impairment level: better eye: moderate impairment: lesser eye: total impairment (disorder),Impairment level: total impairment of both eyes (disorder)
79004009,75133003,Impairment level: better eye: moderate impairment: lesser eye: total impairment (disorder),Impairment level: moderate impairment of both eyes (disorder)
399279001,708515003,Acquired bladder neck obstruction (disorder),Acquired obstruction of urinary tract (disorder)
119423009,716077006,Benign teratoma of ovary (disorder),Teratoma of ovary (disorder)
210987008,429433004,Abrasion of face (disorder),Injury of soft tissue of face (disorder)
400947008,410506005,Congenital fibrosis of inferior rectus muscle (disorder),Inferior rectus muscle restriction (disorder)
94082003,93715005,Primary malignant neoplasm of tail of pancreas (disorder),Primary malignant neoplasm of body of pancreas (disorder)
723013007,271807003,Acute papular eruption of skin (disorder),Eruption of skin (disorder)
18644006,300408001,Increased gastric tonus (finding),Finding of tone of abdomen (finding)
23631000119109,473424007,Sensorineural hearing loss in left ear (disorder),Hearing loss of left ear (disorder)
23631000119109,1088891000119106,Sensorineural hearing loss in left ear (disorder),Hearing loss in left ear (disorder)
233961000,280136002,Lower limb ischemia (disorder),Disorder of soft tissue of lower limb (disorder)
722681008,286899003,Primary mixed adenocarcinoma of endometrium (disorder),Carcinoma of genital organ (disorder)
403950007,93663003,Moll's gland adenocarcinoma (disorder),Primary malignant neoplasm of skin with adnexal differentiation (disorder)
366038003,366034001,Finding of position of artificial lens (finding),Finding of position of lens (finding)
1075131000119100,301721000119106,Acquired hallux limitus of right great toe (disorder),Acquired deformity of toe of right foot (disorder)
195470008,239990000,Rectal skin tag (disorder),Soft tissue lesion of pelvic region (disorder)
195470008,400106006,Rectal skin tag (disorder),Disorder of skin of trunk (disorder)
299661006,299224005,Asymmetry of pelvis (finding),Finding of proportion of lower limb (finding)
16026351000119101,16007631000119106,Congenital arteriovenous malformation of right upper limb (disorder),Congenital anomaly of blood vessel of right upper limb (disorder)
15737841000119109,12239221000119100,Anterior subcapsular cataract of left eye (disorder),Cataract of left eye (disorder)
284216004,211768003,Superficial corrosion of chest wall (disorder),Corrosion of first degree of trunk (disorder)
299199000,299041004,Thumb joint painful on movement (finding),Finding of movement of hand (finding)
430935001,301021005,Chronic ulcer of toe (disorder),Ulcer of toe (disorder)
189053003,310600009,Benign neoplasm of eyelid including canthus (disorder),Benign neoplasm of canthus (disorder)
203062006,280135003,Contracture of wrist flexor(s) (disorder),Disorder of soft tissue of upper limb (disorder)
192718002,87536007,Post polio vaccination encephalitis (disorder),Central nervous system complication (disorder)
43337002,207798009,Open fracture of alveolar border of body of mandible (disorder),"Fracture of alveolus, open (disorder)"
301935005,301923006,Finding of measures of anterior chamber (finding),Finding of measures of globe (finding)
94027007,93834003,Primary malignant neoplasm of skin of groin (disorder),Primary malignant neoplasm of inguinal region (disorder)
192713006,87536007,Post smallpox vaccination encephalitis (disorder),Central nervous system complication (disorder)
209814007,239990000,"Complete tear, sacrotuberous ligament (disorder)",Soft tissue lesion of pelvic region (disorder)
209814007,700009007,"Complete tear, sacrotuberous ligament (disorder)",Injury of pelvic girdle (disorder)
209814007,385424001,"Complete tear, sacrotuberous ligament (disorder)",Injury of connective tissue (disorder)
209814007,280136002,"Complete tear, sacrotuberous ligament (disorder)",Disorder of soft tissue of lower limb (disorder)
209814007,105606008,"Complete tear, sacrotuberous ligament (disorder)",Injury of musculoskeletal system (disorder)
263179007,269078005,Fracture of transverse process of spine with spinal cord lesion (disorder),Fracture of spine with spinal cord lesion (disorder)
126619007,280132000,Neoplasm of muscle of neck (disorder),Disorder of soft tissue of neck (disorder)
66830009,116225000,Open wound of nose with complication (disorder),Complication of injury (disorder)
66830009,79167003,Open wound of nose with complication (disorder),Open wound of face with complication (disorder)
208669004,208660000,"Open fracture ankle, trimalleolar, high fibular fracture (disorder)","Open fracture ankle, lateral malleolus, high (disorder)"
298608005,298183002,Increased passive range of lumbar spine flexion (finding),Passive range of joint movement increased (finding)
402775007,363133001,Genetic disorder of nail (disorder),Genetic disorder of extremity (disorder)
6893006,289210008,First stage of labor (finding),Finding of first stage of labor (finding)
286342004,286330009,Difficulty producing appropriate voice volume (finding),Difficulty producing voice (finding)
286342004,365032007,Difficulty producing appropriate voice volume (finding),Finding related to ability to perform functions related to communication (finding)
314883003,280135003,Complete tear of ligament of hand (disorder),Disorder of soft tissue of upper limb (disorder)
199312002,118185001,Finding related to risk factor in pregnancy (finding),Finding related to pregnancy (finding)
70123009,95463009,Congenital cubitus valgus (disorder),Congenital anomaly of joint (disorder)
719840003,88631000119105,Renal dysplasia with limb defect syndrome (disorder),Dysplasia of limb (disorder)
733227000,444003007,Injury of muscle of rotator cuff (disorder),Disorder of joint of shoulder region (disorder)
11315321000119105,12030001000004100,Pathological fracture of left rib (disorder),Fracture of left rib (disorder)
209775008,724973005,Mallet finger with closed tendon injury (disorder),Injury of tendon of extensor muscle of finger at forearm level (disorder)
209775008,52011008,Mallet finger with closed tendon injury (disorder),Injury of finger (disorder)
283324004,429433004,Insect bite of eye region (disorder),Injury of soft tissue of face (disorder)
222008,408669002,Acute epiglottitis with obstruction (disorder),Acute laryngitis with obstruction (disorder)
308889004,280133005,Leakage of lymph from thoracic duct (disorder),Disorder of soft tissue of trunk (disorder)
110169005,210987008,Abrasion of preauricular region of face (disorder),Abrasion of face (disorder)
110169005,429433004,Abrasion of preauricular region of face (disorder),Injury of soft tissue of face (disorder)
285391000,280136002,Strain of muscle of lower limb (disorder),Disorder of soft tissue of lower limb (disorder)
60676002,95695004,Secondary vitreoretinal degeneration (disorder),Degeneration of retina (disorder)
92364005,92394004,Benign neoplasm of skin of groin (disorder),Benign neoplasm of soft tissues of lower limb (disorder)
237661003,95831008,Ectopic growth hormone releasing hormone secretion causing acromegaly (finding),Ectopic growth hormone secretion (finding)
365249007,364786002,Finding related to ability to prepare food for eating (finding),Finding of eating ability (finding)
15742281000119102,451431000124104,Sinus tarsi syndrome of left ankle (disorder),Disorder of left lower extremity (disorder)
95810005,402697000,Infection of external auditory canal (disorder),Infection of external ear (disorder)
301109008,300577008,Tricuspid valve lesion (finding),Finding of lesion (finding)
722854006,280133005,Congenital hypoganglionosis of large intestine (disorder),Disorder of soft tissue of trunk (disorder)
722854006,1492007,Congenital hypoganglionosis of large intestine (disorder),Congenital anomaly of large intestine (disorder)
56663002,402697000,Acute infection of pinna (disorder),Infection of external ear (disorder)
30828007,22137006,"Anoxia, in liveborn infant (disorder)","Hypoxia, in liveborn infant (disorder)"
447150006,38978009,Friction burn of scalp (disorder),Burn of scalp (disorder)
366471005,366504001,Finding of shoulder joint - range of movement (finding),Finding of movement of shoulder (finding)
423535002,400106006,Basal cell carcinoma of chest wall (disorder),Disorder of skin of trunk (disorder)
423535002,280133005,Basal cell carcinoma of chest wall (disorder),Disorder of soft tissue of trunk (disorder)
423535002,712750007,Basal cell carcinoma of chest wall (disorder),Malignant neoplasm of chest wall (disorder)
724350009,199879009,Hereditary hypotrichosis with recurrent skin vesicles syndrome (disorder),Congenital anomaly of skin (disorder)
246831001,246833003,Symblepharon to lid (disorder),Symblepharon to globe (disorder)
16003671000119101,15729561000119103,Tendinitis of left rotator cuff (disorder),Arthropathy of left shoulder (disorder)
16003671000119101,443798008,Tendinitis of left rotator cuff (disorder),Inflammation of joint of shoulder region (disorder)
726217008,280136002,Injury of fascia of muscle of hip (disorder),Disorder of soft tissue of lower limb (disorder)
109941002,109947003,Primary malignant neoplasm of peripheral nerves of thorax (disorder),Primary malignant neoplasm of peripheral nerves of trunk (disorder)
109941002,188325002,Primary malignant neoplasm of peripheral nerves of thorax (disorder),Malignant neoplasm of peripheral nerve of thorax (disorder)
109941002,126991009,Primary malignant neoplasm of peripheral nerves of thorax (disorder),Neoplasm of peripheral nerves of thorax (disorder)
109941002,94062002,Primary malignant neoplasm of peripheral nerves of thorax (disorder),Primary malignant neoplasm of soft tissues of thorax (disorder)
718551002,280133005,Moyamoya disease with early onset achalasia (disorder),Disorder of soft tissue of trunk (disorder)
22471005,253172000,Hemispheric cerebellar agenesis (disorder),Agenesis of cerebellum (disorder)
298497001,430886005,Deformity of thoracic vertebra (disorder),Disorder of vertebra (disorder)
66937008,280133005,"Glycogen storage disease, type III (disorder)",Disorder of soft tissue of trunk (disorder)
93286002,253959002,Congenital hypoplasia of pubis (disorder),Hypoplasia of lower limb (disorder)
94665001,371972005,Secondary malignant neoplasm of uterus (disorder),Malignant neoplasm of body of uterus (disorder)
191851001,1461000119109,Hallucinogen dependence in remission (disorder),Drug dependence in remission (disorder)
721609009,722996009,Extensive aganglionosis Hirschsprung disease (disorder),Congenital malformation of autonomic nervous system (disorder)
85542007,400106006,Perineal laceration involving skin (disorder),Disorder of skin of trunk (disorder)
85542007,280133005,Perineal laceration involving skin (disorder),Disorder of soft tissue of trunk (disorder)
441761004,429433004,Sprain of ligament of face (disorder),Injury of soft tissue of face (disorder)
262925007,283951006,Rupture of suspensory ligament of penis (disorder),Rupture of penis (disorder)
423280002,310599006,Malignant melanoma of skin of canthus of eye (disorder),Malignant neoplasm of canthus (disorder)
86393005,363056008,Median nail dystrophy (disorder),Degenerative disorder of extremity (disorder)
262585002,91146006,Superficial burn of finger (disorder),Burn erythema of back of hand (disorder)
246609006,277293005,Palpable thickening of ulnar nerve at elbow (finding),Peripheral nerve thickening (finding)
210565009,116225000,Open wound of hand with complication (disorder),Complication of injury (disorder)
210565009,77893004,Open wound of hand with complication (disorder),Open wound of upper limb with complication (disorder)
283212009,283211002,Fishing hook in genitalia (disorder),Fishing hook in perineum (disorder)
247362001,247353003,Pain on abdominal wall movement (finding),Site of abdominal pain (finding)
247362001,418532000,Pain on abdominal wall movement (finding),Abdominal wall movement (finding)
92661009,93898002,Carcinoma in situ of multiple endocrine glands (disorder),Primary malignant neoplasm of multiple endocrine glands (disorder)
370243007,370244001,Superficial laceration of finger (disorder),Superficial laceration of hand (disorder)
370243007,283035001,Superficial laceration of finger (disorder),Superficial injury of dorsum of hand (disorder)
209239005,704210003,Closed fracture dislocation acromioclavicular joint (disorder),Closed fracture of shoulder (disorder)
209239005,36991002,Closed fracture dislocation acromioclavicular joint (disorder),Closed fracture of upper limb (disorder)
10628951000119102,118930001,Acute lymphadenitis of face (disorder),Disorder of face (disorder)
199244000,27342004,Anemia during pregnancy - baby delivered (disorder),Anemia of pregnancy (disorder)
203077003,280136002,Contracture of tibialis anterior (disorder),Disorder of soft tissue of lower limb (disorder)
397449004,301855007,Lymphoma involves multiple lymph node regions (finding),Finding of lymph node (finding)
423439006,422483008,Sleep pattern disrupts family lifestyle (finding),Rest pattern disrupts family lifestyle (finding)
234200002,280133005,Vascular graft enteric fistula (disorder),Disorder of soft tissue of trunk (disorder)
239967005,128133004,Contracture of tendon of elbow region (disorder),Disorder of elbow (disorder)
249771001,298742007,Finding of change in ring size (finding),Finding of size of upper limb (finding)
249771001,366545009,Finding of change in ring size (finding),Finding of size of hand (finding)
249771001,366552006,Finding of change in ring size (finding),Finding of size of finger (finding)
205439003,205437001,Congenital partial fusion of spine with hemivertebra - unbalanced (disorder),Congenital partial fusion of spine - unbalanced (disorder)
724912008,280135003,Injury of bursa at upper arm level (disorder),Disorder of soft tissue of upper limb (disorder)
209502008,724973005,"Sprain, extensor digitorum tendon (disorder)",Injury of tendon of extensor muscle of finger at forearm level (disorder)
71112001,72970002,Normal ulnar pulse (finding),Normal vital signs (finding)
5095008,270291000119109,Gender identity disorder of childhood (disorder),Identity disorder of childhood (disorder)
